,ID,Date,Tweet,stance
0,1.64332e+18,2023-04-04 18:27:48+00:00,recovery economic demographic military debt inflation push humans nature wipeout climate change fallout natural disasters wars resources migration amp blame bankruptcies closures russia china amp covid humans poverty humans alive 70yrs ago,believer
1,1.64332e+18,2023-04-04 18:27:40+00:00,proudelephantus hellonheels2020 beach mansion climate change hypocrites live beaches wind turbines legally forbidden ruin views,neutral
2,1.64332e+18,2023-04-04 18:27:36+00:00,recovery economic demographic military debt inflation push humans nature wipeout climate change fallout natural disasters wars resources migration amp blame bankruptcies closures russia china amp covid humans poverty humans alive 70yrs ago,believer
3,1.64332e+18,2023-04-04 18:27:31+00:00,evelyn von warnitz added logline titled amazing life stage32 co pbsj4nydar via stage32 amwriting screenwriting climatechange,denier
4,1.64332e+18,2023-04-04 18:27:22+00:00,royalaviaire reversed climate change,denier
